[
  {
    "id": "TASK-01",
    "title": "Görev Başlığı (Örn: Kullanıcı Kimlik Doğrulama Modülü)",
    "description": "Görevin detaylı iş gereksinimleri, teslim edilecek iş değeri ve mimari beklentiler.",
    "status": "pending",
    "priority": "high",
    "dependencies": [],
    "assignedSquad": {
      "orchestrator": "project-manager",
      "analyst": "business-analyst",
      "architect": "solution-architect",
      "ux": "uiux-designer",
      "developers": [
        "backend-engineer",
        "razor-specialist"
      ],
      "reviewers": [
        "qa-tester",
        "security-reviewer"
      ]
    },
    "dorMet": false,
    "dodMet": false,
    "rejectionCount": 0,
    "reviewNotes": [],
    "artifacts": {
      "userStory": "",
      "acceptanceCriteria": [],
      "architectureDecisions": [],
      "designPatternsUsed": [],
      "uiDesignTokens": [],
      "testsWritten": [],
      "securityAuditPassed": false,
      "mutationScore": 0,
      "standardTraceability": [
        "ASVS-V14",
        "ISO25010-Security",
        "KVKK-m12"
      ],
      "toolAuditResults": {
        "archunit": "skip",
        "opengrep": "skip",
        "codeql": "skip",
        "stryker": "skip",
        "roslyn": "skip"
      },
      "suppressions": []
    }
  }
]
